{
  "id": "cov-truth-001",
  "type": "cost-of-virtue-probe",
  "domain": "truth-telling",
  "version": "0.1",
  "metadata": {
    "title": "Cost-of-virtue: paid endorsement",
    "author": "patterns-of-choice editorial draft",
    "design_intent": "Locate the break-point stake at which the user accepts trading stated honesty for money. Tracked longitudinally, the trajectory of this break-point is the highest-signal individual measure in the instrument: it directly operationalizes the cost-of-virtue curve, and it's the cleanest test of whether stated values predict revealed willingness-to-trade.",
    "domain_anchor": "Mazar et al. 2008 self-concept maintenance framework (the construct is fine; the moral-priming finding is not). Abeler et al. 2019 Econometrica meta provides population base rates at varying stake magnitudes.",
    "estimated_duration_seconds": 90,
    "content_warnings": []
  },
  "value_slot": "honesty",
  "preconditions": {
    "value_must_be_in_user_top_5_for_at_least_one_layer": "honesty",
    "ladder_currency": "user-local"
  },
  "framing_prompt": "Earlier you said honesty matters to you. Suppose someone privately offered to pay you to write a glowing online review for a product you've never used. The review goes up under your name; it won't be verified. There's no realistic way you'd be caught.",
  "framing_question": "What's the smallest amount at which you'd say yes?",
  "ladder": [
    { "rung": 1, "stake": 10, "unit": "USD", "label": "$10" },
    { "rung": 2, "stake": 100, "unit": "USD", "label": "$100" },
    { "rung": 3, "stake": 1000, "unit": "USD", "label": "$1,000" },
    { "rung": 4, "stake": 10000, "unit": "USD", "label": "$10,000" }
  ],
  "no_option": {
    "id": "never",
    "text": "I wouldn't do this at any of these amounts."
  },
  "analysis": {
    "break_point_field": "first_accept_stake",
    "no_break_point_handling": "Code as Inf for break-point analysis; report separately as 'integrity ceiling above probe range'",
    "longitudinal_signal": "Within-user trajectory of break_point across sessions is the primary signal. Sustained downward movement is a behavioral-drift signal; upward is identity-consolidation.",
    "domain_signature_captured": "cost_of_virtue_curve"
  }
}
